{
  "assignment_id": "assignment_6763e6291aa5d22e632b98e5",
  "assignment_probability": 0.5,
  "block_id": "block_ada396bf1c95319b4b5ab2e6",
  "created_at": "2026-09-04T00:00:00Z",
  "data_origin": "synthetic",
  "participant_group": "latin",
  "participant_id": "synp_reference_001",
  "protocol_version": "1.0.0",
  "questionnaire_version": "1.0.0",
  "quota_snapshot": {
    "group_assignment_count_before": 0,
    "group_sequence": 0
  },
  "resume_next_trial": 1,
  "schema_version": "1.0.0",
  "seed_sha256": "ce35a8de70dca9dddf57ec9ada49dce58efa5554c908ba1a539a34e5c1a161c7",
  "status": "assigned",
  "study_id": "study_cross_cultural_v1",
  "trials": [
    {
      "asset_path": "data/fixtures/asset_system/reference_handoff_v1/fixture/derived/asset_c7e16ea61e90d876c6fe05b9.B_shape.png",
      "asset_sha256": "578e75ef3abe8d182efce7c9b8445fedc673eeef74397fe0f23c04ecc309199b",
      "condition": "visual_blind",
      "is_anchor": true,
      "presentation_id": "presentation_6a3cd2657dc666015fa5c344",
      "source_stimulus_id": "stim_eco_ed82ad5985adf0287b9a",
      "stimulus_id": "stim_task03_latin_01",
      "trial_index": 1,
      "work_id": "work_task03_latin_01",
      "writing_system": "latin"
    },
    {
      "asset_path": "data/fixtures/asset_system/reference_handoff_v1/fixture/derived/asset_c7e16ea61e90d876c6fe05b9.B_shape.png",
      "asset_sha256": "578e75ef3abe8d182efce7c9b8445fedc673eeef74397fe0f23c04ecc309199b",
      "condition": "visual_blind",
      "is_anchor": true,
      "presentation_id": "presentation_dd46fa3bdf67302ec6949def",
      "source_stimulus_id": "stim_eco_ed82ad5985adf0287b9a",
      "stimulus_id": "stim_task03_han_01",
      "trial_index": 2,
      "work_id": "work_task03_han_01",
      "writing_system": "han"
    },
    {
      "asset_path": "data/fixtures/asset_system/reference_handoff_v1/fixture/derived/asset_c7e16ea61e90d876c6fe05b9.B_shape.png",
      "asset_sha256": "578e75ef3abe8d182efce7c9b8445fedc673eeef74397fe0f23c04ecc309199b",
      "condition": "visual_blind",
      "is_anchor": false,
      "presentation_id": "presentation_8572f657f8ad60dc2e39e080",
      "source_stimulus_id": "stim_eco_ed82ad5985adf0287b9a",
      "stimulus_id": "stim_task03_kana_03",
      "trial_index": 3,
      "work_id": "work_task03_kana_03",
      "writing_system": "kana"
    },
    {
      "asset_path": "data/fixtures/asset_system/reference_handoff_v1/fixture/derived/asset_c7e16ea61e90d876c6fe05b9.B_shape.png",
      "asset_sha256": "578e75ef3abe8d182efce7c9b8445fedc673eeef74397fe0f23c04ecc309199b",
      "condition": "visual_blind",
      "is_anchor": false,
      "presentation_id": "presentation_9506ec6581358f083b70cdc3",
      "source_stimulus_id": "stim_eco_ed82ad5985adf0287b9a",
      "stimulus_id": "stim_task03_hangul_02",
      "trial_index": 4,
      "work_id": "work_task03_hangul_02",
      "writing_system": "hangul"
    },
    {
      "asset_path": "data/fixtures/asset_system/reference_handoff_v1/fixture/derived/asset_c7e16ea61e90d876c6fe05b9.B_shape.png",
      "asset_sha256": "578e75ef3abe8d182efce7c9b8445fedc673eeef74397fe0f23c04ecc309199b",
      "condition": "visual_blind",
      "is_anchor": false,
      "presentation_id": "presentation_92cdd9105bb87b7ab4e286e7",
      "source_stimulus_id": "stim_eco_ed82ad5985adf0287b9a",
      "stimulus_id": "stim_task03_latin_03",
      "trial_index": 5,
      "work_id": "work_task03_latin_03",
      "writing_system": "latin"
    },
    {
      "asset_path": "data/fixtures/asset_system/reference_handoff_v1/fixture/derived/asset_c7e16ea61e90d876c6fe05b9.B_shape.png",
      "asset_sha256": "578e75ef3abe8d182efce7c9b8445fedc673eeef74397fe0f23c04ecc309199b",
      "condition": "visual_blind",
      "is_anchor": false,
      "presentation_id": "presentation_247cac3fc7028fef453d21c1",
      "source_stimulus_id": "stim_eco_ed82ad5985adf0287b9a",
      "stimulus_id": "stim_task03_han_03",
      "trial_index": 6,
      "work_id": "work_task03_han_03",
      "writing_system": "han"
    },
    {
      "asset_path": "data/fixtures/asset_system/reference_handoff_v1/fixture/derived/asset_c7e16ea61e90d876c6fe05b9.B_shape.png",
      "asset_sha256": "578e75ef3abe8d182efce7c9b8445fedc673eeef74397fe0f23c04ecc309199b",
      "condition": "visual_blind",
      "is_anchor": false,
      "presentation_id": "presentation_4d90b35d9554f8135ac2fcfd",
      "source_stimulus_id": "stim_eco_ed82ad5985adf0287b9a",
      "stimulus_id": "stim_task03_kana_02",
      "trial_index": 7,
      "work_id": "work_task03_kana_02",
      "writing_system": "kana"
    },
    {
      "asset_path": "data/fixtures/asset_system/reference_handoff_v1/fixture/derived/asset_c7e16ea61e90d876c6fe05b9.B_shape.png",
      "asset_sha256": "578e75ef3abe8d182efce7c9b8445fedc673eeef74397fe0f23c04ecc309199b",
      "condition": "visual_blind",
      "is_anchor": false,
      "presentation_id": "presentation_6e2c3abdebd7fc3717bb22df",
      "source_stimulus_id": "stim_eco_ed82ad5985adf0287b9a",
      "stimulus_id": "stim_task03_hangul_04",
      "trial_index": 8,
      "work_id": "work_task03_hangul_04",
      "writing_system": "hangul"
    }
  ]
}
